1410,AAAAAAAACIFAAAAA,\\N,2450271,325735,1000.00,1,\\N,\\N,N,N,N,\\N,\\N,\\N,N,Tiny items differ by a shops. Parti,\\N,N
1411,AAAAAAAADIFAAAAA,2450544,2450591,245222,1000.00,1,ought,Y,N,N,N,N,N,N,N,Courses must not tak,Unknown,N
1412,AAAAAAAAEIFAAAAA,2450135,2450152,500708,1000.00,1,able,N,N,N,N,N,N,N,N,Proposed circumstances make nece,Unknown,N
1413,AAAAAAAAFIFAAAAA,2450117,2450155,389092,1000.00,1,pri,Y,N,N,N,N,N,N,N,Files ought to grip so excellent faces. Good lovers,Unknown,N
1414,AAAAAAAAGIFAAAAA,2450790,2450846,252164,1000.00,1,ese,N,N,N,N,N,N,N,N,Redundant results trust also terrible visitors; u,Unknown,N
1415,AAAAAAAAHIFAAAAA,2450431,2450438,345628,1000.00,1,anti,Y,N,N,N,N,N,N,N,Dead\, reasonable prod,Unknown,N
1416,AAAAAAAAIIFAAAAA,2450829,2450865,428738,1000.00,1,cally,Y,N,N,N,N,N,N,N,Tremendous lists can,Unknown,N
1417,AAAAAAAAJIFAAAAA,2450599,2450636,148741,1000.00,1,ation,N,N,N,N,N,N,N,N,Complete\, major sales make to ,Unknown,N
1418,AAAAAAAAKIFAAAAA,2450167,2450214,137377,1000.00,1,eing,Y,N,N,N,N,N,N,N,Champions could fall just in the c,Unknown,N
1419,AAAAAAAALIFAAAAA,2450678,2450724,282782,1000.00,1,n st,Y,N,N,N,N,N,N,N,Features must help simply severe f,Unknown,N
1420,AAAAAAAAMIFAAAAA,\\N,\\N,18097,\\N,1,bar,\\N,\\N,\\N,\\N,N,N,N,N,Only public pages would fir,Unknown,N
1421,AAAAAAAANIFAAAAA,2450265,2450318,119444,1000.00,1,ought,Y,N,N,N,N,N,N,N,Able clothes admit on a facilities. Likely\, doubl,Unknown,N
1422,AAAAAAAAOIFAAAAA,2450302,2450304,185636,1000.00,1,able,Y,N,N,N,N,N,N,N,Long participants ought to include as. Recent ,Unknown,N
1423,AAAAAAAAPIFAAAAA,2450700,2450715,40888,1000.00,1,pri,Y,N,N,N,N,N,N,N,Single glasses develop just. Masses wou,Unknown,N
1424,AAAAAAAAAJFAAAAA,2450625,2450643,10720,1000.00,1,ese,Y,N,N,N,N,N,N,N,Appropriate thousands might not separate in a le,Unknown,N
1425,AAAAAAAABJFAAAAA,2450746,2450760,409033,1000.00,1,anti,Y,N,N,N,N,N,N,N,British leaves could not play serious\, maxim,Unknown,N
1426,AAAAAAAACJFAAAAA,2450270,2450305,493034,1000.00,1,cally,Y,N,N,N,N,N,N,N,Members know in a considerations; variables will help f,Unknown,N
1427,AAAAAAAADJFAAAAA,2450556,2450560,171346,1000.00,1,ation,Y,N,N,N,N,N,N,N,Weeks think probably ,Unknown,N
1428,AAAAAAAAEJFAAAAA,2450767,2450824,8914,1000.00,1,eing,N,N,N,N,N,N,N,N,Important hands ought to s,Unknown,N
1429,AAAAAAAAFJFAAAAA,2450701,2450746,34411,1000.00,\\N,\\N,N,\\N,N,N,N,\\N,N,\\N,\\N,\\N,\\N
1430,AAAAAAAAGJFAAAAA,2450335,2450394,37279,1000.00,1,bar,N,N,N,N,N,N,N,N,Awards used to watch to a pray,Unknown,N
1431,AAAAAAAAHJFAAAAA,2450288,2450317,112927,1000.00,1,ought,Y,N,N,N,N,N,N,N,Important\, economic pp. acce,Unknown,N
1432,AAAAAAAAIJFAAAAA,2450572,2450622,8374,1000.00,1,able,N,N,N,N,N,N,N,N,Hard\, parliamentary centuries work und,Unknown,N
1433,AAAAAAAAJJFAAAAA,2450900,2450914,272288,1000.00,1,pri,N,N,N,N,N,N,N,N,Maximum\, likely investments used to lie on a activities.,Unknown,N
1434,AAAAAAAAKJFAAAAA,2450320,2450325,402610,1000.00,1,ese,N,N,N,N,N,N,N,N,American thousands let to a leade,Unknown,N
1435,AAAAAAAALJFAAAAA,2450545,2450579,427696,1000.00,1,anti,Y,N,N,N,N,N,N,N,Absolutely general events m,Unknown,N
1436,AAAAAAAAMJFAAAAA,2450826,2450837,404281,1000.00,1,cally,N,N,N,N,N,N,N,N,Choices should get friendly eyes. Even st,Unknown,N
1437,AAAAAAAANJFAAAAA,2450134,2450170,445040,1000.00,1,ation,N,N,N,N,N,N,N,N,National situations s,Unknown,N
1438,AAAAAAAAOJFAAAAA,2450587,2450624,385681,1000.00,1,eing,Y,N,N,N,N,N,N,N,Old words could take beautiful\,,Unknown,N
1439,AAAAAAAAPJFAAAAA,2450464,2450480,374743,1000.00,1,n st,N,N,N,N,N,N,N,N,Members should wish also. Closer outside factors refuse,Unknown,N
1440,AAAAAAAAAKFAAAAA,2450596,2450640,155494,1000.00,1,bar,N,N,N,N,N,N,N,N,Over religious attacks make straight leaves. Do,Unknown,N
1441,AAAAAAAABKFAAAAA,2450392,2450429,250840,1000.00,1,ought,N,N,N,N,N,N,N,N,Excellent kids suppor,Unknown,N
1442,AAAAAAAACKFAAAAA,2450343,2450375,449158,1000.00,1,able,Y,N,N,N,N,N,N,N,Due\, educational changes could fill gr,Unknown,N
1443,AAAAAAAADKFAAAAA,2450575,2450612,87886,1000.00,1,pri,Y,N,N,N,N,N,N,N,Strategies could not play pretty\, good co,Unknown,N
1444,AAAAAAAAEKFAAAAA,2450300,2450306,140944,1000.00,1,ese,Y,N,N,N,N,N,N,N,Other arms ought to rest wit,Unknown,N
1445,AAAAAAAAFKFAAAAA,2450639,2450693,207730,1000.00,1,anti,Y,N,N,N,N,N,N,N,Pieces endanger so. Remaining flats might draw ago.,Unknown,N
1446,AAAAAAAAGKFAAAAA,2450748,2450777,141518,1000.00,1,cally,Y,N,N,N,N,N,N,N,Physical negotiations must prevent befor,Unknown,N
1447,AAAAAAAAHKFAAAAA,2450174,2450227,252002,1000.00,1,ation,N,N,N,N,N,N,N,N,Of course black classes run conditions. ,Unknown,N
1448,AAAAAAAAIKFAAAAA,2450826,2450850,377006,1000.00,1,eing,N,N,N,N,N,N,N,N,Rural\, technical banks could arrange sufficient\, complete gr,Unknown,N
1449,AAAAAAAAJKFAAAAA,2450720,2450727,181520,1000.00,1,n st,N,N,N,N,N,N,N,N,Post-war securities ought t,Unknown,N
1450,AAAAAAAAKKFAAAAA,2450892,2450932,444008,1000.00,1,bar,N,N,N,N,N,N,N,N,Thereafter continued arms ex,Unknown,N
1451,AAAAAAAALKFAAAAA,2450472,2450527,52243,1000.00,1,ought,N,N,N,N,N,N,N,N,Perfect\, bad investors m,Unknown,N
1452,AAAAAAAAMKFAAAAA,2450598,2450630,382208,1000.00,1,able,Y,N,N,N,N,N,N,N,Various\, intelligent days know. Cond,Unknown,N
1453,AAAAAAAANKFAAAAA,2450733,2450740,343304,1000.00,1,pri,Y,N,N,N,N,N,N,N,Great\, medical answers should show entirely in ,Unknown,N
1454,AAAAAAAAOKFAAAAA,2450258,2450315,318730,1000.00,1,ese,N,N,N,N,N,N,N,N,Unchanged\, leading benefits help on,Unknown,N
1455,AAAAAAAAPKFAAAAA,2450668,2450675,39230,1000.00,1,anti,N,N,N,N,N,N,N,N,Even beautiful males will need of course always clin,Unknown,N
1456,AAAAAAAAALFAAAAA,2450722,2450775,338770,1000.00,1,cally,N,N,N,N,N,N,N,N,Main\, flexible eyes must take only likely brothers. J,Unknown,N
1457,AAAAAAAABLFAAAAA,2450133,2450179,406138,1000.00,1,ation,N,N,N,N,N,N,N,N,Very remarkable commitments can get about go,Unknown,N
1458,AAAAAAAACLFAAAAA,2450519,2450542,293755,1000.00,1,eing,Y,N,N,N,N,N,N,N,Protective articles shall not want there ab,Unknown,N
1459,AAAAAAAADLFAAAAA,2450765,2450783,1964,1000.00,1,n st,N,N,N,N,N,N,N,N,Rough\, gradual newspapers may bargain. Orders must not act,Unknown,N
1460,AAAAAAAAELFAAAAA,2450282,2450317,174160,1000.00,1,bar,N,N,N,N,N,N,N,N,Also traditional par,Unknown,N
1461,AAAAAAAAFLFAAAAA,2450382,2450436,13184,1000.00,1,ought,Y,N,N,N,N,N,N,N,Legal\, different farmers could not think initially major in,Unknown,N
1462,AAAAAAAAGLFAAAAA,2450381,2450384,131782,1000.00,1,able,N,N,N,N,N,N,N,N,Recent initiatives mean single\, religious markets,Unknown,N
1463,AAAAAAAAHLFAAAAA,2450751,2450780,69253,1000.00,1,pri,N,N,N,N,N,N,N,N,As proper parties would know telecommu,Unknown,N
1464,AAAAAAAAILFAAAAA,2450286,2450343,160990,1000.00,1,ese,N,N,N,N,N,N,N,N,At least dangerous years direct more hardly dif,Unknown,N
1465,AAAAAAAAJLFAAAAA,2450338,2450389,253330,1000.00,1,anti,N,N,N,N,N,N,N,N,Patterns would make possi,Unknown,N
1466,AAAAAAAAKLFAAAAA,2450520,2450541,125516,1000.00,1,cally,N,N,N,N,N,N,N,N,Top passengers might need old\, valuable ways. Sho,Unknown,N
1467,AAAAAAAALLFAAAAA,2450397,2450410,87254,1000.00,1,ation,N,N,N,N,N,N,N,N,Now able articles limit considerably.,Unknown,N
1468,AAAAAAAAMLFAAAAA,2450787,2450789,393142,1000.00,1,eing,N,N,N,N,N,N,N,N,Titles give to a wings. Only high stories trust natura,Unknown,N
1469,AAAAAAAANLFAAAAA,2450430,2450460,415483,1000.00,1,n st,N,N,N,N,N,N,N,N,Liberal\, full men implement to a expectations. Then ,Unknown,N
1470,AAAAAAAAOLFAAAAA,2450774,2450808,240056,1000.00,1,bar,N,N,N,N,N,N,N,N,Levels confirm ahead classes. Again different years manag,Unknown,N
1471,AAAAAAAAPLFAAAAA,2450271,2450330,255530,1000.00,1,ought,N,N,N,N,N,N,N,N,Arguments should swim good contents. Main charts c,Unknown,N
1472,AAAAAAAAAMFAAAAA,2450295,2450310,121699,1000.00,1,able,Y,N,N,N,N,N,N,N,Old depths detect then for,Unknown,N
1473,AAAAAAAABMFAAAAA,2450268,2450300,43486,1000.00,1,pri,Y,N,N,N,N,N,N,N,Now true men cannot inc,Unknown,N
1474,AAAAAAAACMFAAAAA,2450881,2450912,137974,1000.00,1,ese,N,N,N,N,N,N,N,N,As appropriate rates push simply free\, black kinds. Chemica,Unknown,N
1475,AAAAAAAADMFAAAAA,2450769,2450781,40237,1000.00,1,anti,N,N,N,N,N,N,N,N,Often free groups experiment then personal priorities. O,Unknown,N
1476,AAAAAAAAEMFAAAAA,2450525,2450552,356188,1000.00,1,cally,Y,N,N,N,N,N,N,N,Nations rise in a unions. Countries think again key allowa,Unknown,N
1477,AAAAAAAAFMFAAAAA,2450160,2450216,475942,1000.00,1,ation,Y,N,N,N,N,N,N,N,Only shapes work also left hopes. Awar,Unknown,N
1478,AAAAAAAAGMFAAAAA,2450112,2450148,399890,1000.00,1,eing,Y,N,N,N,N,N,N,N,Different meals should appear really. Dra,Unknown,N
1479,AAAAAAAAHMFAAAAA,2450697,2450752,112312,1000.00,1,n st,N,N,N,N,N,N,N,N,Parts admit maybe blank years. Extreme states would precipi,Unknown,N
1480,AAAAAAAAIMFAAAAA,2450755,2450796,264811,1000.00,1,bar,N,N,N,N,N,N,N,N,Procedures take lovingly. Organic\, inc tensions fi,Unknown,N
1481,AAAAAAAAJMFAAAAA,2450819,2450857,19718,1000.00,1,ought,Y,N,N,N,N,N,N,N,Unknown\, interior re,Unknown,N
1482,AAAAAAAAKMFAAAAA,2450635,2450688,295,1000.00,1,able,N,N,N,N,N,N,N,N,Windows must light alm,Unknown,N
1483,AAAAAAAALMFAAAAA,2450261,2450310,308402,1000.00,1,pri,N,N,N,N,N,N,N,N,Backs will not give tomorrow i,Unknown,N
1484,AAAAAAAAMMFAAAAA,2450120,2450162,486566,1000.00,1,ese,Y,N,N,N,N,N,N,N,Just head networks can furnish even settings; various\, pop,Unknown,N
1485,AAAAAAAANMFAAAAA,2450704,2450747,93511,1000.00,1,anti,Y,N,N,N,N,N,N,N,Together mental applications remain ev,Unknown,N
1486,AAAAAAAAOMFAAAAA,2450264,2450309,146780,1000.00,1,cally,Y,N,N,N,N,N,N,N,Years feel particularly. Sports look things. General fun,Unknown,N
1487,AAAAAAAAPMFAAAAA,2450241,2450271,315412,1000.00,1,ation,N,N,N,N,N,N,N,N,Else high representations meet so single tr,Unknown,N
1488,AAAAAAAAANFAAAAA,2450449,2450488,344014,1000.00,1,eing,Y,N,N,N,N,N,N,N,Continuously independent cel,Unknown,N
1489,AAAAAAAABNFAAAAA,2450487,2450499,472465,1000.00,1,n st,Y,N,N,N,N,N,N,N,Final policies might not like for example with ,Unknown,N
1490,AAAAAAAACNFAAAAA,2450908,2450933,365593,1000.00,1,bar,Y,N,N,N,N,N,N,N,Long\, rare contributions may talk t,Unknown,N
1491,AAAAAAAADNFAAAAA,2450619,2450666,6889,1000.00,1,ought,N,N,N,N,N,N,N,N,Securities expand pp.. Classic\, impossible surround,Unknown,N
1492,AAAAAAAAENFAAAAA,2450735,2450767,289088,1000.00,1,able,Y,N,N,N,N,N,N,N,Significant\, blind adv,Unknown,N
1493,AAAAAAAAFNFAAAAA,2450569,2450573,382376,1000.00,1,pri,Y,N,N,N,N,N,N,N,Pupils start central\, modern arts; new\, old contents avo,Unknown,N
1494,AAAAAAAAGNFAAAAA,2450576,2450631,202124,1000.00,1,ese,N,N,N,N,N,N,N,N,Secondary nations get very in,Unknown,N
1495,AAAAAAAAHNFAAAAA,2450587,2450621,152540,1000.00,1,anti,N,N,N,N,N,N,N,N,Very lacking clients consider almost. Avai,Unknown,N
1496,AAAAAAAAINFAAAAA,2450137,2450158,150955,1000.00,1,cally,Y,N,N,N,N,N,N,N,Great ears ought to allow dirty\, sma,Unknown,N
1497,AAAAAAAAJNFAAAAA,2450138,2450168,462932,1000.00,1,ation,N,N,N,N,N,N,N,N,Dirty\, white women come today able\, new hosp,Unknown,N
1498,AAAAAAAAKNFAAAAA,2450127,2450175,370418,1000.00,1,eing,Y,N,N,N,N,N,N,N,Methods take more techniques; months shall hate very min,Unknown,N
1499,AAAAAAAALNFAAAAA,2450833,2450836,65653,1000.00,1,n st,N,N,N,N,N,N,N,N,Better appropriate eyes recall rep,Unknown,N
1500,AAAAAAAAMNFAAAAA,2450535,2450575,162698,1000.00,1,bar,Y,N,N,N,N,N,N,N,Personal\, different colours loa,Unknown,N