1206,AAAAAAAAGLEAAAAA,2450905,2450962,303734,1000.00,1,cally,N,N,N,N,N,N,N,N,Coldly necessary blocks can identif,Unknown,N
1207,AAAAAAAAHLEAAAAA,2450309,2450317,261380,1000.00,1,ation,N,N,N,N,N,N,N,N,New\, local times might not wis,Unknown,N
1208,AAAAAAAAILEAAAAA,2450225,2450246,304102,1000.00,1,eing,N,N,N,N,N,N,N,N,Husbands keep then national funds. Annual boxes ,Unknown,N
1209,AAAAAAAAJLEAAAAA,2450742,2450749,190480,1000.00,1,n st,N,N,N,N,N,N,N,N,Political\, industrial fingers f,Unknown,N
1210,AAAAAAAAKLEAAAAA,2450795,2450847,497114,1000.00,1,bar,N,N,N,N,N,N,N,N,Canadian products ought to believe much leaders. Silver\, ,Unknown,N
1211,AAAAAAAALLEAAAAA,2450782,2450811,402778,1000.00,1,ought,N,N,N,N,N,N,N,N,Experimental children fight so; quiet bird,Unknown,N
1212,AAAAAAAAMLEAAAAA,2450330,2450388,117619,1000.00,1,able,Y,N,N,N,N,N,N,N,More reasonable markets will not look yesterday close excel,Unknown,N
1213,AAAAAAAANLEAAAAA,2450470,2450503,447958,1000.00,1,pri,N,N,N,N,N,N,N,N,Aims say briefly whol,Unknown,N
1214,AAAAAAAAOLEAAAAA,2450217,2450267,144115,1000.00,1,ese,Y,N,N,N,N,N,N,N,Economic teeth examine ro,Unknown,N
1215,AAAAAAAAPLEAAAAA,2450378,2450429,35785,1000.00,1,anti,Y,N,N,N,N,N,N,N,Only other judges should not att,Unknown,N
1216,AAAAAAAAAMEAAAAA,2450241,2450278,314236,1000.00,1,cally,Y,N,N,N,N,N,N,N,Steps request however as unlike boxes. Scotti,Unknown,N
1217,AAAAAAAABMEAAAAA,2450462,2450469,24134,1000.00,1,ation,Y,N,N,N,N,N,N,N,Times describe else other rig,Unknown,N
1218,AAAAAAAACMEAAAAA,2450582,2450616,289156,1000.00,1,eing,N,N,N,N,N,N,N,N,Significant years should enable only soviet\,,Unknown,N
1219,AAAAAAAADMEAAAAA,2450202,2450212,370214,1000.00,1,n st,N,N,N,N,N,N,N,N,More red ideas cause fine hours,Unknown,N
1220,AAAAAAAAEMEAAAAA,2450825,2450876,249190,1000.00,1,bar,Y,N,N,N,N,N,N,N,Hard other numbers may not create as around a books,Unknown,N
1221,AAAAAAAAFMEAAAAA,2450721,2450754,44089,1000.00,1,ought,N,N,N,N,N,N,N,N,Only foreign days stand there ,Unknown,N
1222,AAAAAAAAGMEAAAAA,2450228,2450253,394634,1000.00,1,able,N,N,N,N,N,N,N,N,There specialist programmes,Unknown,N
1223,AAAAAAAAHMEAAAAA,2450724,2450752,211606,1000.00,1,pri,N,N,N,N,N,N,N,N,Working-class trees should call well other h,Unknown,N
1224,AAAAAAAAIMEAAAAA,2450492,2450502,203386,1000.00,1,ese,N,N,N,N,N,N,N,N,Only bad appeals might ,Unknown,N
1225,AAAAAAAAJMEAAAAA,2450460,2450472,\\N,\\N,\\N,\\N,Y,\\N,N,N,\\N,\\N,\\N,N,Readers can reveal minute functions. Economic po,Unknown,N
1226,AAAAAAAAKMEAAAAA,2450541,2450597,43294,1000.00,1,cally,N,N,N,N,N,N,N,N,Large\, international talk,Unknown,N
1227,AAAAAAAALMEAAAAA,2450484,2450531,87758,1000.00,1,ation,N,N,N,N,N,N,N,N,Particularly considerable stones write ,Unknown,N
1228,AAAAAAAAMMEAAAAA,2450656,2450688,465427,1000.00,1,eing,Y,N,N,N,N,N,N,N,Only minutes vary more; recordings ,Unknown,N
1229,AAAAAAAANMEAAAAA,2450702,2450744,381055,1000.00,1,n st,N,N,N,N,N,N,N,N,Great names market mainly. A,Unknown,N
1230,AAAAAAAAOMEAAAAA,2450680,2450731,369880,1000.00,1,bar,Y,N,N,N,N,N,N,N,Most related images may ,Unknown,N
1231,AAAAAAAAPMEAAAAA,2450892,2450902,486841,1000.00,1,ought,Y,N,N,N,N,N,N,N,Economic\, social neg,Unknown,N
1232,AAAAAAAAANEAAAAA,2450743,2450800,241994,1000.00,1,able,Y,N,N,N,N,N,N,N,Severe societies must affor,Unknown,N
1233,AAAAAAAABNEAAAAA,2450640,2450700,450044,1000.00,1,pri,N,N,N,N,N,N,N,N,Cautiously serious areas remove in ,Unknown,N
1234,AAAAAAAACNEAAAAA,2450572,2450620,297712,1000.00,1,ese,Y,N,N,N,N,N,N,N,Difficult days allow jobs. La,Unknown,N
1235,AAAAAAAADNEAAAAA,2450844,2450887,152398,1000.00,1,anti,Y,N,N,N,N,N,N,N,English cases see too large products. Bonds ear,Unknown,N
1236,AAAAAAAAENEAAAAA,2450770,2450797,191662,1000.00,1,cally,Y,N,N,N,N,N,N,N,More new studies may complain slowly supposedly ext,Unknown,N
1237,AAAAAAAAFNEAAAAA,2450802,2450841,459916,1000.00,1,ation,Y,N,N,N,N,N,N,N,Old days move mentally united trees; later due germans com,Unknown,N
1238,AAAAAAAAGNEAAAAA,2450835,2450857,259792,1000.00,1,eing,Y,N,N,N,N,N,N,N,Useful\, right students happen now o,Unknown,N
1239,AAAAAAAAHNEAAAAA,2450771,2450829,140722,1000.00,1,n st,N,N,N,N,N,N,N,N,Hundreds guess low both short teams; boys make easy as bla,Unknown,N
1240,AAAAAAAAINEAAAAA,2450746,2450803,27932,1000.00,1,bar,Y,N,N,N,N,N,N,N,Certain individuals sha,Unknown,N
1241,AAAAAAAAJNEAAAAA,2450602,2450644,138116,1000.00,1,ought,N,N,N,N,N,N,N,N,Always important men ought to rescue american\, rel,Unknown,N
1242,AAAAAAAAKNEAAAAA,2450468,2450527,50000,1000.00,1,able,N,N,N,N,N,N,N,N,Especially poor kids try rather than a,Unknown,N
1243,AAAAAAAALNEAAAAA,2450509,2450529,149888,1000.00,1,pri,Y,N,N,N,N,N,N,N,Also different details come occasionally countr,Unknown,N
1244,AAAAAAAAMNEAAAAA,2450352,2450380,228946,1000.00,1,ese,Y,N,N,N,N,N,N,N,Fit\, high lights would not know. Genuine states see ,Unknown,N
1245,AAAAAAAANNEAAAAA,2450180,2450208,480925,1000.00,1,anti,N,N,N,N,N,N,N,N,Variable regulations en,Unknown,N
1246,AAAAAAAAONEAAAAA,2450352,2450370,354796,1000.00,1,cally,N,N,N,N,N,N,N,N,Hostile ranks cannot need then special lips. Narrow\, corpora,Unknown,N
1247,AAAAAAAAPNEAAAAA,2450906,2450928,191414,1000.00,1,ation,Y,N,N,N,N,N,N,N,Miles transfer for instance elements. Str,Unknown,N
1248,AAAAAAAAAOEAAAAA,2450449,2450490,110707,1000.00,1,eing,Y,N,N,N,N,N,N,N,Very american cars start outwards other image,Unknown,N
1249,AAAAAAAABOEAAAAA,2450757,2450788,1790,1000.00,1,n st,Y,N,N,N,N,N,N,N,Real boards would not come goals.,Unknown,N
1250,AAAAAAAACOEAAAAA,2450458,2450474,124870,1000.00,1,bar,N,N,N,N,N,N,N,N,Still political decisions may exhibit for ,Unknown,N
1251,AAAAAAAADOEAAAAA,2450838,2450878,386468,1000.00,1,ought,N,N,N,N,N,N,N,N,Relations ought to go patterns; deve,Unknown,N
1252,AAAAAAAAEOEAAAAA,2450431,2450472,69062,1000.00,1,able,Y,N,N,N,N,N,N,N,Increased\, excellent particles ought to become much ,Unknown,N
1253,AAAAAAAAFOEAAAAA,2450578,2450632,392162,1000.00,1,pri,Y,N,N,N,N,N,N,N,Then average months ,Unknown,N
1254,AAAAAAAAGOEAAAAA,2450871,2450917,154339,1000.00,1,ese,Y,N,N,N,N,N,N,N,Administrative\, british months must cope ,Unknown,N
1255,AAAAAAAAHOEAAAAA,2450720,2450752,250606,1000.00,1,anti,Y,N,N,N,N,N,N,N,Domestic children shall leave nearly ,Unknown,N
1256,AAAAAAAAIOEAAAAA,2450472,2450473,291610,1000.00,1,cally,N,N,N,N,N,N,N,N,Short\, elderly parts shall ,Unknown,N
1257,AAAAAAAAJOEAAAAA,2450300,2450315,47990,1000.00,1,ation,N,N,N,N,N,N,N,N,Square\, famous remains lift as a ,Unknown,N
1258,AAAAAAAAKOEAAAAA,2450538,2450595,406429,1000.00,1,eing,Y,N,N,N,N,N,N,N,Available tiles shall not cl,Unknown,N
1259,AAAAAAAALOEAAAAA,2450587,2450617,405475,1000.00,1,n st,N,N,N,N,N,N,N,N,Direct pale rights may write ,Unknown,N
1260,AAAAAAAAMOEAAAAA,2450368,2450409,364882,1000.00,1,bar,Y,N,N,N,N,N,N,N,Forward major injuries must reconstruct soon overseas ,Unknown,N
1261,AAAAAAAANOEAAAAA,2450610,2450651,257917,1000.00,1,ought,Y,N,N,N,N,N,N,N,More regional negotiations work. Small\, remarkable r,Unknown,N
1262,AAAAAAAAOOEAAAAA,2450766,2450807,108025,1000.00,1,able,Y,N,N,N,N,N,N,N,Urgent\, rapid days require precious amounts; new,Unknown,N
1263,AAAAAAAAPOEAAAAA,2450198,2450203,429338,1000.00,1,pri,Y,N,N,N,N,N,N,N,Expectations must meet mainly dead\, popular nations. Defe,Unknown,N
1264,AAAAAAAAAPEAAAAA,2450596,2450642,30520,1000.00,1,ese,Y,N,N,N,N,N,N,N,Details may produce always. Others ,Unknown,N
1265,AAAAAAAABPEAAAAA,2450552,2450555,332624,1000.00,1,anti,N,N,N,N,N,N,N,N,Reports should rely. Western\, competitive issues ,Unknown,N
1266,AAAAAAAACPEAAAAA,2450370,2450406,142921,1000.00,1,cally,N,N,N,N,N,N,N,N,Electrical\, new communities will not hold again new,Unknown,N
1267,AAAAAAAADPEAAAAA,2450630,2450631,27481,1000.00,1,ation,N,N,N,N,N,N,N,N,Easy\, annual eyes must not,Unknown,N
1268,AAAAAAAAEPEAAAAA,2450326,2450337,221524,1000.00,1,eing,Y,N,N,N,N,N,N,N,Much similar hands give even to a,Unknown,N
1269,AAAAAAAAFPEAAAAA,2450472,2450493,480838,1000.00,1,n st,Y,N,N,N,N,N,N,N,Regions ought to undergo much ,Unknown,N
1270,AAAAAAAAGPEAAAAA,2450132,2450173,118948,1000.00,1,bar,N,N,N,N,N,N,N,N,Shares will pay proportions. So light interests reme,Unknown,N
1271,AAAAAAAAHPEAAAAA,2450404,2450451,158912,1000.00,1,ought,N,N,N,N,N,N,N,N,Much legal yards should quit on a men. Now political ,Unknown,N
1272,AAAAAAAAIPEAAAAA,2450434,2450472,286082,1000.00,1,able,Y,N,N,N,N,N,N,N,Also principal teams need then by a friends. Large years,Unknown,N
1273,AAAAAAAAJPEAAAAA,2450170,2450177,294932,1000.00,1,pri,N,N,N,N,N,N,N,N,Outside rare systems may pr,Unknown,N
1274,AAAAAAAAKPEAAAAA,2450601,2450611,58846,1000.00,1,ese,N,N,N,N,N,N,N,N,No longer rare days get. Alway,Unknown,N
1275,AAAAAAAALPEAAAAA,2450478,2450494,357673,1000.00,1,anti,N,N,N,N,N,N,N,N,Main questions used to,Unknown,N
1276,AAAAAAAAMPEAAAAA,2450791,2450840,386392,1000.00,1,cally,N,N,N,N,N,N,N,N,Indeed left years pro,Unknown,N
1277,AAAAAAAANPEAAAAA,2450530,2450538,53104,1000.00,1,ation,Y,N,N,N,N,N,N,N,Expert reports could feel for the re,Unknown,N
1278,AAAAAAAAOPEAAAAA,2450882,2450922,325742,1000.00,1,eing,N,N,N,N,N,N,N,N,Parts apply certain\, military services. Other\, large ,Unknown,N
1279,AAAAAAAAPPEAAAAA,2450579,2450614,214921,1000.00,1,n st,N,N,N,N,N,N,N,N,Sharp\, young benefits acknowledge researchers. Co,Unknown,N
1280,AAAAAAAAAAFAAAAA,2450496,2450542,213242,1000.00,1,bar,N,N,N,N,N,N,N,N,External\, literary races should not wash cons,Unknown,N
1281,AAAAAAAABAFAAAAA,2450200,2450219,358160,1000.00,1,ought,Y,N,N,N,N,N,N,N,Opposite\, natural drugs used to maintain,Unknown,N
1282,AAAAAAAACAFAAAAA,2450485,2450519,392660,1000.00,1,able,N,N,N,N,N,N,N,N,Practical\, other times worry much,Unknown,N
1283,AAAAAAAADAFAAAAA,2450418,2450471,332062,1000.00,1,pri,Y,N,N,N,N,N,N,N,High countries provide oth,Unknown,N
1284,AAAAAAAAEAFAAAAA,2450329,2450351,348776,1000.00,1,ese,Y,N,N,N,N,N,N,N,Pregnant states like different\, formal fans. Exciting,Unknown,N
1285,AAAAAAAAFAFAAAAA,2450351,2450359,295420,1000.00,1,anti,N,N,N,N,N,N,N,N,Therefore social opportunities retur,Unknown,N
1286,AAAAAAAAGAFAAAAA,2450564,2450584,120013,1000.00,1,cally,Y,N,N,N,N,N,N,N,Elaborate organs take again children. Systems might answer ,Unknown,N
1287,AAAAAAAAHAFAAAAA,2450311,2450321,453806,1000.00,1,ation,N,N,N,N,N,N,N,N,Joint\, irrelevant casualties should get at all s,Unknown,N
1288,AAAAAAAAIAFAAAAA,2450212,2450217,438694,1000.00,1,eing,N,N,N,N,N,N,N,N,Almost tired countries m,Unknown,N
1289,AAAAAAAAJAFAAAAA,2450726,2450766,266023,1000.00,1,n st,N,N,N,N,N,N,N,N,Vessels would arrive still on a,Unknown,N
1290,AAAAAAAAKAFAAAAA,2450138,2450194,455098,1000.00,1,bar,Y,N,N,N,N,N,N,N,Only easy costs could get commercial far,Unknown,N
1291,AAAAAAAALAFAAAAA,2450765,2450793,54127,1000.00,1,ought,N,N,N,N,N,N,N,N,Economic\, administrative sales ,Unknown,N
1292,AAAAAAAAMAFAAAAA,2450130,2450186,294338,1000.00,1,able,Y,N,N,N,N,N,N,N,Familiar\, other protests would mean for example consi,Unknown,N
1293,AAAAAAAANAFAAAAA,2450590,2450636,369034,1000.00,1,pri,Y,N,N,N,N,N,N,N,Fresh\, good birds divert then; aspirations mi,Unknown,N
1294,AAAAAAAAOAFAAAAA,2450151,2450156,33115,1000.00,1,ese,N,N,N,N,N,N,N,N,Local girls may not avoid obviously in a reactions. Free\, g,Unknown,N
1295,AAAAAAAAPAFAAAAA,2450337,2450338,358556,1000.00,1,anti,N,N,N,N,N,N,N,N,Most new interactions must,Unknown,N
1296,AAAAAAAAABFAAAAA,2450365,2450389,18994,1000.00,1,cally,Y,N,N,N,N,N,N,N,Popular schemes shall feel more potential ,Unknown,N
1297,AAAAAAAABBFAAAAA,2450443,2450458,193976,1000.00,1,ation,Y,N,N,N,N,N,N,N,Words would not cause ev,Unknown,N
1298,AAAAAAAACBFAAAAA,2450802,2450814,27130,1000.00,1,eing,N,N,N,N,N,N,N,N,Somewhere local rates allow etc. Chil,Unknown,N
1299,AAAAAAAADBFAAAAA,2450288,2450300,425725,1000.00,1,n st,Y,N,N,N,N,N,N,N,Common artists meet wide. L,Unknown,N
1300,AAAAAAAAEBFAAAAA,2450863,2450890,83395,1000.00,1,bar,Y,N,N,N,N,N,N,N,Small\, universal appeals rescue fully happy\, victor,Unknown,N
1301,AAAAAAAAFBFAAAAA,2450516,2450575,449833,1000.00,1,ought,Y,N,N,N,N,N,N,N,Teams could afford away. Old ye,Unknown,N
1302,AAAAAAAAGBFAAAAA,2450261,2450282,169426,1000.00,1,able,N,N,N,N,N,N,N,N,Sequences shall object since a rumours. Brothers s,Unknown,N
1303,AAAAAAAAHBFAAAAA,2450748,2450790,50830,1000.00,1,pri,Y,N,N,N,N,N,N,N,Papers must not leave for lo,Unknown,N
1304,AAAAAAAAIBFAAAAA,2450885,2450916,56846,1000.00,1,ese,Y,N,N,N,N,N,N,N,Sorry years may provide also. Different project,Unknown,N
1305,AAAAAAAAJBFAAAAA,2450779,2450801,415636,1000.00,1,anti,Y,N,N,N,N,N,N,N,Systems may not take. Remain,Unknown,N
1306,AAAAAAAAKBFAAAAA,2450236,2450291,460006,1000.00,1,cally,Y,N,N,N,N,N,N,N,Rather racial views remember overseas,Unknown,N
1307,AAAAAAAALBFAAAAA,2450661,2450710,229202,1000.00,1,ation,N,N,N,N,N,N,N,N,Times could not explain so automa,Unknown,N
1308,AAAAAAAAMBFAAAAA,2450584,2450636,353695,1000.00,1,eing,Y,N,N,N,N,N,N,N,New\, likely rumours may not aid furthermore on a proc,Unknown,N
1309,AAAAAAAANBFAAAAA,2450900,2450947,241903,1000.00,1,n st,Y,N,N,N,N,N,N,N,Results form. Red\, perfect prospects enter someti,Unknown,N
1310,AAAAAAAAOBFAAAAA,2450799,2450823,246194,1000.00,1,bar,N,N,N,N,N,N,N,N,Sides should not prevent about. Identical children complain ,Unknown,N
1311,AAAAAAAAPBFAAAAA,2450284,2450318,411964,1000.00,1,ought,N,N,N,N,N,N,N,N,Civil\, private horses would ,Unknown,N
1312,AAAAAAAAACFAAAAA,2450436,2450449,273235,1000.00,1,able,Y,N,N,N,N,N,N,N,Confident cells may not look abroad major\, appar,Unknown,N
1313,AAAAAAAABCFAAAAA,2450704,2450731,68317,1000.00,1,pri,Y,N,N,N,N,N,N,N,Namely consistent hours should not like serious\, im,Unknown,N
1314,AAAAAAAACCFAAAAA,2450787,2450843,483650,1000.00,1,ese,Y,N,N,N,N,N,N,N,Words know correct\, industrial sections,Unknown,N
1315,AAAAAAAADCFAAAAA,2450285,2450293,167524,1000.00,1,anti,N,N,N,N,N,N,N,N,Minutes operate. Alone\, f,Unknown,N
1316,AAAAAAAAECFAAAAA,2450658,2450673,119156,1000.00,1,cally,N,N,N,N,N,N,N,N,Labour\, poor chairs die less. Well scottish conditions may ,Unknown,N
1317,AAAAAAAAFCFAAAAA,2450460,2450497,221797,1000.00,1,ation,Y,N,N,N,N,N,N,N,Probably mysterious years mean there muc,Unknown,N
1318,AAAAAAAAGCFAAAAA,2450355,2450363,421280,1000.00,1,eing,N,N,N,N,N,N,N,N,Widespread pounds market in partic,Unknown,N
1319,AAAAAAAAHCFAAAAA,2450586,2450634,330646,1000.00,1,n st,Y,N,N,N,N,N,N,N,Superior\, successful nights call so individual minutes. Mo,Unknown,N
1320,AAAAAAAAICFAAAAA,2450143,2450177,283940,1000.00,1,bar,N,N,N,N,N,N,N,N,Teams know especially under the featur,Unknown,N
1321,AAAAAAAAJCFAAAAA,2450759,2450791,381344,1000.00,1,ought,Y,N,N,N,N,N,N,N,National paintings might not give ,Unknown,N
1322,AAAAAAAAKCFAAAAA,2450239,2450289,331681,1000.00,1,able,N,N,N,N,N,N,N,N,Mice disappear particularly. Good languages pret,Unknown,N
1323,AAAAAAAALCFAAAAA,2450115,2450148,361843,1000.00,1,pri,Y,N,N,N,N,N,N,N,Regions should go practically on a year,Unknown,N
1324,AAAAAAAAMCFAAAAA,2450306,2450329,190603,1000.00,1,ese,Y,N,N,N,N,N,N,N,Enormous\, psychiatric gaps illustrate fast\, natural,Unknown,N
1325,AAAAAAAANCFAAAAA,2450898,2450934,45020,1000.00,1,anti,Y,N,N,N,N,N,N,N,Loyal\, normal patients ought to come close therefore op,Unknown,N
1326,AAAAAAAAOCFAAAAA,2450723,2450779,438932,1000.00,1,cally,N,N,N,N,N,N,N,N,Sensible agreements will confirm as b,Unknown,N
1327,AAAAAAAAPCFAAAAA,2450903,2450939,358594,1000.00,1,ation,N,N,N,N,N,N,N,N,Golden times answer; even long-term offen,Unknown,N
1328,AAAAAAAAADFAAAAA,2450524,2450554,334162,1000.00,1,eing,Y,N,N,N,N,N,N,N,Red years provide toxic\, true gifts. Possibili,Unknown,N
1329,AAAAAAAABDFAAAAA,2450719,2450748,30184,1000.00,1,n st,Y,N,N,N,N,N,N,N,Poorly open successes should wake examp,Unknown,N
1330,AAAAAAAACDFAAAAA,2450467,2450477,375670,1000.00,1,bar,N,N,N,N,N,N,N,N,Others could declare then other eyes; brit,Unknown,N
1331,AAAAAAAADDFAAAAA,2450377,2450398,264673,1000.00,1,ought,Y,N,N,N,N,N,N,N,Western\, expected eye,Unknown,N
1332,AAAAAAAAEDFAAAAA,2450419,2450469,280705,1000.00,1,able,N,N,N,N,N,N,N,N,African\, liable rights st,Unknown,N
1333,AAAAAAAAFDFAAAAA,2450278,2450279,329182,1000.00,1,pri,N,N,N,N,N,N,N,N,Good\, crude matters must tell so various associa,Unknown,N
1334,AAAAAAAAGDFAAAAA,2450606,2450637,48157,1000.00,1,ese,N,N,N,N,N,N,N,N,Whole residents forestall essential\, ric,Unknown,N
1335,AAAAAAAAHDFAAAAA,2450370,2450402,240625,1000.00,1,anti,Y,N,N,N,N,N,N,N,Disabled\, early patients let atl,Unknown,N
1336,AAAAAAAAIDFAAAAA,2450888,2450913,349124,1000.00,1,cally,Y,N,N,N,N,N,N,N,Systems match against a banks. Cultural\, stand,Unknown,N
1337,AAAAAAAAJDFAAAAA,2450366,2450372,237067,1000.00,1,ation,Y,N,N,N,N,N,N,N,Sometimes statutory issues ought to ensure als,Unknown,N
1338,AAAAAAAAKDFAAAAA,2450755,2450797,9404,1000.00,1,eing,Y,N,N,N,N,N,N,N,Men sell very for the reso,Unknown,N
1339,AAAAAAAALDFAAAAA,2450410,2450467,143636,1000.00,1,n st,Y,N,N,N,N,N,N,N,Fields may not pause owne,Unknown,N
1340,AAAAAAAAMDFAAAAA,2450373,2450406,46372,1000.00,1,bar,Y,N,N,N,N,N,N,N,Cases should manage suddenly. Powerful steps,Unknown,N
1341,AAAAAAAANDFAAAAA,2450128,2450160,248684,1000.00,1,ought,N,N,N,N,N,N,N,N,Paintings shall get very in pa,Unknown,N
1342,AAAAAAAAODFAAAAA,2450632,2450657,186506,1000.00,1,able,Y,N,N,N,N,N,N,N,Other units used to take. Sets create more young vessels.,Unknown,N
1343,AAAAAAAAPDFAAAAA,2450625,2450684,321668,1000.00,1,pri,N,N,N,N,N,N,N,N,Really civil stones will invi,Unknown,N
1344,AAAAAAAAAEFAAAAA,2450422,2450463,279478,1000.00,1,ese,Y,N,N,N,N,N,N,N,Low old needs prevent perhaps minutes; lo,Unknown,N
1345,AAAAAAAABEFAAAAA,2450864,2450869,121126,1000.00,1,anti,N,N,N,N,N,N,N,N,Immensely continued rights tear bloody sons. Parliamen,Unknown,N
1346,AAAAAAAACEFAAAAA,2450649,2450688,297298,1000.00,1,cally,N,N,N,N,N,N,N,N,Fierce opportunities affect to a years. Ethical co,Unknown,N
1347,AAAAAAAADEFAAAAA,2450721,2450741,153440,1000.00,1,ation,N,N,N,N,N,N,N,N,Inland jewish phenomena say better min,Unknown,N
1348,AAAAAAAAEEFAAAAA,2450240,2450285,476114,1000.00,1,eing,Y,N,N,N,N,N,N,N,Also basic rights shall get a littl,Unknown,N
1349,AAAAAAAAFEFAAAAA,2450900,2450956,420226,1000.00,1,n st,N,N,N,N,N,N,N,N,Wet\, traditional rises should help social\, sexu,Unknown,N
1350,AAAAAAAAGEFAAAAA,2450535,2450581,486349,1000.00,1,bar,Y,N,N,N,N,N,N,N,Necessary\, environmental combin,Unknown,N
1351,AAAAAAAAHEFAAAAA,2450288,2450331,366523,1000.00,1,ought,Y,N,N,N,N,N,N,N,Necessary\, working buses justify native\, consta,Unknown,N
1352,AAAAAAAAIEFAAAAA,\\N,\\N,\\N,1000.00,\\N,\\N,Y,N,\\N,\\N,\\N,N,N,N,\\N,\\N,\\N
1353,AAAAAAAAJEFAAAAA,2450253,2450281,101449,1000.00,1,pri,N,N,N,N,N,N,N,N,Books shall cover here mental themes; local pictures would,Unknown,N
1354,AAAAAAAAKEFAAAAA,2450886,2450924,195976,1000.00,1,ese,Y,N,N,N,N,N,N,N,Rights could not think elaborate\, public explanations. Minut,Unknown,N
1355,AAAAAAAALEFAAAAA,2450239,2450241,377474,1000.00,1,anti,Y,N,N,N,N,N,N,N,Trees reach now local patie,Unknown,N
1356,AAAAAAAAMEFAAAAA,2450389,2450394,290642,1000.00,1,cally,Y,N,N,N,N,N,N,N,Yesterday full frames express remarkably str,Unknown,N
1357,AAAAAAAANEFAAAAA,2450475,2450503,192668,1000.00,1,ation,Y,N,N,N,N,N,N,N,International\, happy opportunities should,Unknown,N
1358,AAAAAAAAOEFAAAAA,2450165,2450218,216409,1000.00,1,eing,N,N,N,N,N,N,N,N,General children see a,Unknown,N
1359,AAAAAAAAPEFAAAAA,2450178,2450208,444862,1000.00,1,n st,N,N,N,N,N,N,N,N,Processes invest however international\, open ga,Unknown,N
1360,AAAAAAAAAFFAAAAA,2450609,2450628,377864,1000.00,1,bar,N,N,N,N,N,N,N,N,Applications used to pay surely. More pleasa,Unknown,N
1361,AAAAAAAABFFAAAAA,2450621,2450657,295687,1000.00,1,ought,Y,N,N,N,N,N,N,N,Weeks act private\, preliminary races; mere\, practical m,Unknown,N
1362,AAAAAAAACFFAAAAA,2450283,2450318,397130,1000.00,1,able,N,N,N,N,N,N,N,N,Formal pages will not see rather in a patients; only f,Unknown,N
1363,AAAAAAAADFFAAAAA,2450596,2450656,300352,1000.00,1,pri,Y,N,N,N,N,N,N,N,Even good telecommunications will no,Unknown,N
1364,AAAAAAAAEFFAAAAA,2450126,2450179,19850,1000.00,1,ese,Y,N,N,N,N,N,N,N,Familiar\, english police extend ,Unknown,N
1365,AAAAAAAAFFFAAAAA,2450835,2450884,224386,1000.00,1,anti,N,N,N,N,N,N,N,N,Forward good classes cannot plan occasionally major wo,Unknown,N
1366,AAAAAAAAGFFAAAAA,2450583,2450608,346166,1000.00,1,cally,N,N,N,N,N,N,N,N,Colleges used to stop then,Unknown,N
1367,AAAAAAAAHFFAAAAA,2450441,2450463,190766,1000.00,1,ation,Y,N,N,N,N,N,N,N,Single\, technologica,Unknown,N
1368,AAAAAAAAIFFAAAAA,2450606,2450623,386050,1000.00,1,eing,Y,N,N,N,N,N,N,N,Parliamentary cities ought to co,Unknown,N
1369,AAAAAAAAJFFAAAAA,2450440,2450457,494890,1000.00,1,n st,N,N,N,N,N,N,N,N,Very allegations would assume explicitly wet\, new scho,Unknown,N
1370,AAAAAAAAKFFAAAAA,2450458,2450484,120169,1000.00,1,bar,N,N,N,N,N,N,N,N,Funny\, electrical judges shall get proud ,Unknown,N
1371,AAAAAAAALFFAAAAA,2450128,2450170,404210,1000.00,1,ought,N,N,N,N,N,N,N,N,Mainly strong windows concentrate here in a ministers; fo,Unknown,N
1372,AAAAAAAAMFFAAAAA,2450372,2450429,98827,1000.00,1,able,Y,N,N,N,N,N,N,N,Wings can attract; bad busy cheeks should not,Unknown,N
1373,AAAAAAAANFFAAAAA,2450260,2450285,303913,1000.00,1,pri,N,N,N,N,N,N,N,N,Unlikely\, old rules s,Unknown,N
1374,AAAAAAAAOFFAAAAA,2450410,2450425,38362,1000.00,1,ese,N,N,N,N,N,N,N,N,Here gay subsidies lay secondary\, mad ,Unknown,N
1375,AAAAAAAAPFFAAAAA,2450757,2450787,245440,1000.00,1,anti,Y,N,N,N,N,N,N,N,Ways get also meetings; corporate h,Unknown,N
1376,AAAAAAAAAGFAAAAA,2450278,2450291,407209,1000.00,1,cally,N,N,N,N,N,N,N,N,Even general students examine new\, ready points; answers,Unknown,N
1377,AAAAAAAABGFAAAAA,2450342,2450353,4898,1000.00,1,ation,Y,N,N,N,N,N,N,N,Naturally detailed schools feel streets. Eve,Unknown,N
1378,AAAAAAAACGFAAAAA,2450226,2450242,105626,1000.00,1,eing,N,N,N,N,N,N,N,N,Reasons complete patients. Champions see then already kind,Unknown,N
1379,AAAAAAAADGFAAAAA,2450261,2450298,323623,1000.00,1,n st,N,N,N,N,N,N,N,N,More other agencies take. Similar girls post just scott,Unknown,N
1380,AAAAAAAAEGFAAAAA,2450110,2450113,53620,1000.00,1,bar,Y,N,N,N,N,N,N,N,Digital\, great police go already networks. Thick efforts o,Unknown,N
1381,AAAAAAAAFGFAAAAA,2450577,2450602,201211,1000.00,1,ought,Y,N,N,N,N,N,N,N,Characteristics ought to put early standards; procedure,Unknown,N
1382,AAAAAAAAGGFAAAAA,2450524,2450543,283988,1000.00,1,able,N,N,N,N,N,N,N,N,Protests bring there campaigns; surprised\, increa,Unknown,N
1383,AAAAAAAAHGFAAAAA,2450524,2450546,221206,1000.00,1,pri,N,N,N,N,N,N,N,N,Previous factors could establish cities. Pregn,Unknown,N
1384,AAAAAAAAIGFAAAAA,2450239,2450276,492308,1000.00,1,ese,Y,N,N,N,N,N,N,N,Sure\, psychiatric frien,Unknown,N
1385,AAAAAAAAJGFAAAAA,2450567,2450588,440648,1000.00,1,anti,Y,N,N,N,N,N,N,N,Functions should appoint all complex\, si,Unknown,N
1386,AAAAAAAAKGFAAAAA,2450221,2450239,115760,1000.00,1,cally,Y,N,N,N,N,N,N,N,Features could not last even so indian\, left word,Unknown,N
1387,AAAAAAAALGFAAAAA,2450541,2450563,461308,1000.00,1,ation,Y,N,N,N,N,N,N,N,Existing\, integrated flowers forget hardly vast\, blue netwo,Unknown,N
1388,AAAAAAAAMGFAAAAA,2450238,2450287,484519,1000.00,1,eing,N,N,N,N,N,N,N,N,Married laws earn further in a bran,Unknown,N
1389,AAAAAAAANGFAAAAA,2450591,2450625,344275,1000.00,1,n st,Y,N,N,N,N,N,N,N,Witnesses keep a little by a rooms. Exercises,Unknown,N
1390,AAAAAAAAOGFAAAAA,2450809,2450865,92806,1000.00,1,bar,Y,N,N,N,N,N,N,N,Good\, determined departments attempt other\, ,Unknown,N
1391,AAAAAAAAPGFAAAAA,2450256,2450289,463994,1000.00,1,ought,Y,N,N,N,N,N,N,N,Always new mechanisms shall give hard s,Unknown,N
1392,AAAAAAAAAHFAAAAA,2450119,2450154,198478,1000.00,1,able,Y,N,N,N,N,N,N,N,Likely times may increase,Unknown,N
1393,AAAAAAAABHFAAAAA,2450829,2450854,226114,1000.00,1,pri,Y,N,N,N,N,N,N,N,Sudden\, intermediate years take c,Unknown,N
1394,AAAAAAAACHFAAAAA,2450787,2450806,147073,1000.00,1,ese,Y,N,N,N,N,N,N,N,New floors can roll. Ordinary days,Unknown,N
1395,AAAAAAAADHFAAAAA,2450854,2450904,308788,1000.00,1,anti,Y,N,N,N,N,N,N,N,Maps go wooden\, working provisions. I,Unknown,N
1396,AAAAAAAAEHFAAAAA,2450493,2450551,93082,1000.00,1,cally,N,N,N,N,N,N,N,N,Crude\, small things ought to,Unknown,N
1397,AAAAAAAAFHFAAAAA,2450884,2450895,200156,1000.00,1,ation,N,N,N,N,N,N,N,N,Relations could get yesterday peasants. Demanding\,,Unknown,N
1398,AAAAAAAAGHFAAAAA,2450667,2450698,339542,1000.00,1,eing,N,N,N,N,N,N,N,N,Girls grant shortly. More sexual products will not h,Unknown,N
1399,AAAAAAAAHHFAAAAA,2450127,2450175,465284,1000.00,1,n st,N,N,N,N,N,N,N,N,Glad findings experience then in a incomes. Merely anxiou,Unknown,N
1400,AAAAAAAAIHFAAAAA,2450900,2450948,48865,1000.00,1,bar,N,N,N,N,N,N,N,N,Gradual parts keep general industries. I,Unknown,N
1401,AAAAAAAAJHFAAAAA,2450591,2450648,222661,1000.00,1,ought,N,N,N,N,N,N,N,N,Troops should take lightly authorities. C,Unknown,N
1402,AAAAAAAAKHFAAAAA,2450734,2450767,384991,1000.00,1,able,Y,N,N,N,N,N,N,N,Cautiously foreign bishops shall imagine to,Unknown,N
1403,AAAAAAAALHFAAAAA,2450394,2450444,385099,1000.00,1,pri,N,N,N,N,N,N,N,N,Customers can quit read,Unknown,N
1404,AAAAAAAAMHFAAAAA,2450183,2450233,482584,1000.00,1,ese,Y,N,N,N,N,N,N,N,Bright towns throw on the children; cultural\, like ,Unknown,N
1405,AAAAAAAANHFAAAAA,2450783,2450798,154882,1000.00,1,anti,Y,N,N,N,N,N,N,N,Expensive clients take more in a colleagues. Enough s,Unknown,N
1406,AAAAAAAAOHFAAAAA,2450782,2450838,173554,1000.00,1,cally,Y,N,N,N,N,N,N,N,Part-time stairs show howe,Unknown,N
1407,AAAAAAAAPHFAAAAA,2450638,2450696,106286,1000.00,1,ation,Y,N,N,N,N,N,N,N,Costs allow more even new services. Normal\, po,Unknown,N
1408,AAAAAAAAAIFAAAAA,2450243,2450303,140527,1000.00,1,eing,Y,N,N,N,N,N,N,N,Weak examples like particularly economies. Independent,Unknown,N
1409,AAAAAAAABIFAAAAA,2450874,2450918,440660,1000.00,1,n st,Y,N,N,N,N,N,N,N,Extensive officials emphas,Unknown,N
