1001,AAAAAAAAJODAAAAA,2450895,2450940,99241,1000.00,1,ought,Y,N,N,N,N,N,N,N,However main years could fa,Unknown,N
1002,AAAAAAAAKODAAAAA,2450538,2450586,422410,1000.00,1,able,Y,N,N,N,N,N,N,N,Likewise shared components go agr,Unknown,N
1003,AAAAAAAALODAAAAA,2450339,2450388,341311,1000.00,1,pri,Y,N,N,N,N,N,N,N,Legs sell more in a ho,Unknown,N
1004,AAAAAAAAMODAAAAA,2450365,2450386,65290,1000.00,1,ese,Y,N,N,N,N,N,N,N,Real\, important charges keep especially ,Unknown,N
1005,AAAAAAAANODAAAAA,2450134,2450193,97993,1000.00,1,anti,Y,N,N,N,N,N,N,N,National\, great boundaries,Unknown,N
1006,AAAAAAAAOODAAAAA,2450252,2450308,310810,1000.00,1,cally,N,N,N,N,N,N,N,N,Final\, other ways guide efforts,Unknown,N
1007,AAAAAAAAPODAAAAA,2450317,2450331,273380,1000.00,1,ation,Y,N,N,N,N,N,N,N,Known hundreds must think nearly others. Drugs persuade the,Unknown,N
1008,AAAAAAAAAPDAAAAA,2450897,2450933,185548,1000.00,1,eing,Y,N,N,N,N,N,N,N,Rather minute parent,Unknown,N
1009,AAAAAAAABPDAAAAA,2450842,2450890,40069,1000.00,1,n st,Y,N,N,N,N,N,N,N,Long running charges ought to add great\, alternative st,Unknown,N
1010,AAAAAAAACPDAAAAA,2450175,2450208,141008,1000.00,1,bar,N,N,N,N,N,N,N,N,Presidential\, young i,Unknown,N
1011,AAAAAAAADPDAAAAA,2450186,2450228,372686,1000.00,1,ought,Y,N,N,N,N,N,N,N,British matters may not stay. Black lev,Unknown,N
1012,AAAAAAAAEPDAAAAA,2450477,2450516,139778,1000.00,1,able,Y,N,N,N,N,N,N,N,Different\, civil stat,Unknown,N
1013,AAAAAAAAFPDAAAAA,2450136,2450145,170504,1000.00,1,pri,Y,N,N,N,N,N,N,N,Only\, public thoughts win now mice. Investments happen ,Unknown,N
1014,AAAAAAAAGPDAAAAA,2450342,2450365,331592,1000.00,1,ese,Y,N,N,N,N,N,N,N,As political ways ca,Unknown,N
1015,AAAAAAAAHPDAAAAA,2450171,2450179,175640,1000.00,1,anti,N,N,N,N,N,N,N,N,Brief problems shall ring most supreme bloc,Unknown,N
1016,AAAAAAAAIPDAAAAA,2450608,2450647,491864,1000.00,1,cally,Y,N,N,N,N,N,N,N,Eligible pupils know similar groups. Families t,Unknown,N
1017,AAAAAAAAJPDAAAAA,2450852,2450888,133838,1000.00,1,ation,N,N,N,N,N,N,N,N,More old children examine ye,Unknown,N
1018,AAAAAAAAKPDAAAAA,2450427,2450431,25378,1000.00,1,eing,N,N,N,N,N,N,N,N,However important others cannot exist facts. Forward\, abl,Unknown,N
1019,AAAAAAAALPDAAAAA,2450490,2450521,389935,1000.00,1,n st,N,N,N,N,N,N,N,N,Anxious\, democratic machines bring of course good programm,Unknown,N
1020,AAAAAAAAMPDAAAAA,2450871,2450883,447866,1000.00,1,bar,Y,N,N,N,N,N,N,N,No doubt french problems can indicate a,Unknown,N
1021,AAAAAAAANPDAAAAA,2450498,2450547,296264,1000.00,1,ought,Y,N,N,N,N,N,N,N,Dreadful\, lost clients may wait more actual ,Unknown,N
1022,AAAAAAAAOPDAAAAA,2450862,2450910,476491,1000.00,1,able,Y,N,N,N,N,N,N,N,Rocks create surprisingly in a lines.,Unknown,N
1023,AAAAAAAAPPDAAAAA,2450394,2450414,349880,1000.00,1,pri,N,N,N,N,N,N,N,N,Close\, confident supporters learn. Benefits mus,Unknown,N
1024,AAAAAAAAAAEAAAAA,2450768,2450808,129307,1000.00,1,ese,N,N,N,N,N,N,N,N,Living\, double levels renew. Lon,Unknown,N
1025,AAAAAAAABAEAAAAA,2450378,2450427,108199,1000.00,1,anti,N,N,N,N,N,N,N,N,Additional ambitions say great\, large programmes. Quickly,Unknown,N
1026,AAAAAAAACAEAAAAA,2450354,2450359,16856,1000.00,1,cally,Y,N,N,N,N,N,N,N,Manufacturers repeat opposite\, human crews. Major ,Unknown,N
1027,AAAAAAAADAEAAAAA,2450361,2450365,180025,1000.00,1,ation,N,N,N,N,N,N,N,N,Effects can see only specific schools. British pub,Unknown,N
1028,AAAAAAAAEAEAAAAA,2450769,2450793,266383,1000.00,1,eing,Y,N,N,N,N,N,N,N,Solar actors climb for inst,Unknown,N
1029,AAAAAAAAFAEAAAAA,2450670,2450719,241834,1000.00,1,n st,N,N,N,N,N,N,N,N,Results shall understand able tr,Unknown,N
1030,AAAAAAAAGAEAAAAA,2450290,2450312,384106,1000.00,1,bar,N,N,N,N,N,N,N,N,Periods should release conventional hundreds; areas hear no,Unknown,N
1031,AAAAAAAAHAEAAAAA,2450701,2450751,464822,1000.00,1,ought,N,N,N,N,N,N,N,N,Especially light processes could develop for a hearts,Unknown,N
1032,AAAAAAAAIAEAAAAA,2450365,2450372,16957,1000.00,1,able,Y,N,N,N,N,N,N,N,Silently available books might stay upon,Unknown,N
1033,AAAAAAAAJAEAAAAA,2450565,2450591,490033,1000.00,1,pri,Y,N,N,N,N,N,N,N,Golden days would not lose old\, small,Unknown,N
1034,AAAAAAAAKAEAAAAA,2450723,2450745,415591,1000.00,1,ese,Y,N,N,N,N,N,N,N,Cheerfully common pupils get y,Unknown,N
1035,AAAAAAAALAEAAAAA,2450161,2450164,305582,1000.00,1,anti,Y,N,N,N,N,N,N,N,Then local controls deal he,Unknown,N
1036,AAAAAAAAMAEAAAAA,2450185,2450188,490964,1000.00,1,cally,N,N,N,N,N,N,N,N,At least other decades pay there concerned\, historical,Unknown,N
1037,AAAAAAAANAEAAAAA,2450393,2450413,67120,1000.00,1,ation,N,N,N,N,N,N,N,N,Sorry provisions must endure integrated\,,Unknown,N
1038,AAAAAAAAOAEAAAAA,2450458,2450463,196750,1000.00,1,eing,N,N,N,N,N,N,N,N,Necessary trials consider historic ,Unknown,N
1039,AAAAAAAAPAEAAAAA,2450481,2450523,464695,1000.00,1,n st,Y,N,N,N,N,N,N,N,Labour\, level countries implemen,Unknown,N
1040,AAAAAAAAABEAAAAA,2450547,2450601,131558,1000.00,1,bar,N,N,N,N,N,N,N,N,Safe\, friendly criteria ,Unknown,N
1041,AAAAAAAABBEAAAAA,2450599,2450650,371800,1000.00,1,ought,N,N,N,N,N,N,N,N,Here national methods must like possible men. Democ,Unknown,N
1042,AAAAAAAACBEAAAAA,2450622,2450645,40820,1000.00,1,able,Y,N,N,N,N,N,N,N,Definitely poor forms shoul,Unknown,N
1043,AAAAAAAADBEAAAAA,2450314,2450343,341827,1000.00,1,pri,Y,N,N,N,N,N,N,N,Sexual applications pass drawings. B,Unknown,N
1044,AAAAAAAAEBEAAAAA,2450603,2450621,265370,1000.00,1,ese,N,N,N,N,N,N,N,N,Parts will not hope some,Unknown,N
1045,AAAAAAAAFBEAAAAA,2450777,2450808,51512,1000.00,1,anti,N,N,N,N,N,N,N,N,Even nuclear frames ought to consider ve,Unknown,N
1046,AAAAAAAAGBEAAAAA,2450133,2450142,354712,1000.00,1,cally,N,N,N,N,N,N,N,N,Arts would come. Open\, imperial elements cover alwa,Unknown,N
1047,AAAAAAAAHBEAAAAA,2450716,2450747,16268,1000.00,1,ation,Y,N,N,N,N,N,N,N,Sensible children speculate with a terms. Socia,Unknown,N
1048,AAAAAAAAIBEAAAAA,2450548,2450573,379699,1000.00,1,eing,Y,N,N,N,N,N,N,N,Principally low rates ,Unknown,N
1049,AAAAAAAAJBEAAAAA,2450345,2450399,250624,1000.00,1,n st,Y,N,N,N,N,N,N,N,Days understand legal schools. Following\, beautifu,Unknown,N
1050,AAAAAAAAKBEAAAAA,2450684,2450705,331576,1000.00,1,bar,Y,N,N,N,N,N,N,N,Then left relations revise,Unknown,N
1051,AAAAAAAALBEAAAAA,2450292,2450309,227084,1000.00,1,ought,N,N,N,N,N,N,N,N,Finally reasonable schools help,Unknown,N
1052,AAAAAAAAMBEAAAAA,2450519,2450522,464558,1000.00,1,able,Y,N,N,N,N,N,N,N,International teachers will love very. Jus,Unknown,N
1053,AAAAAAAANBEAAAAA,2450827,2450879,262334,1000.00,1,pri,Y,N,N,N,N,N,N,N,Negotiations read new,Unknown,N
1054,AAAAAAAAOBEAAAAA,2450701,2450722,165404,1000.00,1,ese,Y,N,N,N,N,N,N,N,Other\, ancient years come functional\, high days. H,Unknown,N
1055,AAAAAAAAPBEAAAAA,2450911,2450957,237580,1000.00,1,anti,Y,N,N,N,N,N,N,N,Possible patients will not score as high years. Forward ,Unknown,N
1056,AAAAAAAAACEAAAAA,2450250,2450277,420949,1000.00,1,cally,N,N,N,N,N,N,N,N,Polite residents will ste,Unknown,N
1057,AAAAAAAABCEAAAAA,2450637,2450695,368540,1000.00,1,ation,N,N,N,N,N,N,N,N,Then political days operate originally. No do,Unknown,N
1058,AAAAAAAACCEAAAAA,2450358,2450416,189691,1000.00,1,eing,Y,N,N,N,N,N,N,N,Legitimate\, british buses interrupt i,Unknown,N
1059,AAAAAAAADCEAAAAA,2450182,2450221,308458,1000.00,1,n st,N,N,N,N,N,N,N,N,Ready\, main hours may get s,Unknown,N
1060,AAAAAAAAECEAAAAA,2450301,2450344,130040,1000.00,1,bar,N,N,N,N,N,N,N,N,Positive\, personal months find certainly day,Unknown,N
1061,AAAAAAAAFCEAAAAA,2450846,2450857,222571,1000.00,1,ought,N,N,N,N,N,N,N,N,Professional\, long pubs should turn al,Unknown,N
1062,AAAAAAAAGCEAAAAA,2450884,2450898,44126,1000.00,1,able,N,N,N,N,N,N,N,N,Different\, important researchers wi,Unknown,N
1063,AAAAAAAAHCEAAAAA,\\N,2450419,253294,1000.00,1,pri,\\N,\\N,N,N,\\N,N,N,\\N,Calmly classical sites might interpret afterwards as a agen,\\N,\\N
1064,AAAAAAAAICEAAAAA,2450813,2450835,280048,1000.00,1,ese,N,N,N,N,N,N,N,N,Ready tools zero most. Papers mi,Unknown,N
1065,AAAAAAAAJCEAAAAA,2450753,2450781,187471,1000.00,1,anti,Y,N,N,N,N,N,N,N,Very alone girls put proudly ,Unknown,N
1066,AAAAAAAAKCEAAAAA,2450847,2450857,488116,1000.00,1,cally,N,N,N,N,N,N,N,N,Fingers must write workers. Q,Unknown,N
1067,AAAAAAAALCEAAAAA,2450241,2450261,26395,1000.00,1,ation,Y,N,N,N,N,N,N,N,Days should tell on a s,Unknown,N
1068,AAAAAAAAMCEAAAAA,2450138,2450193,474032,1000.00,1,eing,N,N,N,N,N,N,N,N,Professional parents reveal never n,Unknown,N
1069,AAAAAAAANCEAAAAA,2450377,2450399,85084,1000.00,1,n st,N,N,N,N,N,N,N,N,Palestinian\, royal children try t,Unknown,N
1070,AAAAAAAAOCEAAAAA,2450564,2450619,292610,1000.00,1,bar,N,N,N,N,N,N,N,N,Questions shall pick. Needs feel empty\, other,Unknown,N
1071,AAAAAAAAPCEAAAAA,2450722,2450742,67645,1000.00,1,ought,Y,N,N,N,N,N,N,N,Detectives go to a hospitals. Probable activities should ben,Unknown,N
1072,AAAAAAAAADEAAAAA,2450499,2450549,173206,1000.00,1,able,N,N,N,N,N,N,N,N,Settlements compensate v,Unknown,N
1073,AAAAAAAABDEAAAAA,2450418,2450464,296845,1000.00,1,pri,Y,N,N,N,N,N,N,N,Old\, sufficient documents may paint overnight pregnant lev,Unknown,N
1074,AAAAAAAACDEAAAAA,2450194,2450226,306460,1000.00,1,ese,Y,N,N,N,N,N,N,N,Police shall incur better european fe,Unknown,N
1075,AAAAAAAADDEAAAAA,2450125,2450161,385538,1000.00,1,anti,N,N,N,N,N,N,N,N,Therefore large factors cannot fail perfect products. Men ,Unknown,N
1076,AAAAAAAAEDEAAAAA,2450432,2450483,161732,1000.00,1,cally,Y,N,N,N,N,N,N,N,Badly good levels come easily late\, new packages. Chines,Unknown,N
1077,AAAAAAAAFDEAAAAA,2450212,2450235,150680,1000.00,1,ation,N,N,N,N,N,N,N,N,Rarely obvious forces go less indus,Unknown,N
1078,AAAAAAAAGDEAAAAA,2450335,2450373,19207,1000.00,1,eing,N,N,N,N,N,N,N,N,Children catch causes. Relatively j,Unknown,N
1079,AAAAAAAAHDEAAAAA,2450725,2450777,\\N,1000.00,\\N,n st,Y,\\N,\\N,\\N,\\N,N,N,N,Losses keep later independent\, good res,Unknown,\\N
1080,AAAAAAAAIDEAAAAA,2450273,2450319,138325,1000.00,1,bar,N,N,N,N,N,N,N,N,Days will find merely final firms. In,Unknown,N
1081,AAAAAAAAJDEAAAAA,2450367,2450400,298819,1000.00,1,ought,N,N,N,N,N,N,N,N,Personal\, limited years mention today rules. Also alone,Unknown,N
1082,AAAAAAAAKDEAAAAA,2450159,2450169,156847,1000.00,1,able,Y,N,N,N,N,N,N,N,Active bishops seem sometimes on a facilities. As inte,Unknown,N
1083,AAAAAAAALDEAAAAA,2450564,2450613,60253,1000.00,1,pri,N,N,N,N,N,N,N,N,Financial\, strong others give ,Unknown,N
1084,AAAAAAAAMDEAAAAA,2450296,2450336,352591,1000.00,1,ese,Y,N,N,N,N,N,N,N,Special meals will not commemorate tod,Unknown,N
1085,AAAAAAAANDEAAAAA,2450125,2450147,431464,1000.00,1,anti,N,N,N,N,N,N,N,N,Wide proceedings regret also overall other posts; radica,Unknown,N
1086,AAAAAAAAODEAAAAA,2450576,2450610,193130,1000.00,1,cally,N,N,N,N,N,N,N,N,Individuals suffer fairly wages; conventional,Unknown,N
1087,AAAAAAAAPDEAAAAA,2450633,2450646,262550,1000.00,1,ation,N,N,N,N,N,N,N,N,Free products make just afrai,Unknown,N
1088,AAAAAAAAAEEAAAAA,2450540,2450560,338330,1000.00,1,eing,N,N,N,N,N,N,N,N,Details might hear criti,Unknown,N
1089,AAAAAAAABEEAAAAA,2450247,2450282,289069,1000.00,1,n st,Y,N,N,N,N,N,N,N,Full\, competitive contri,Unknown,N
1090,AAAAAAAACEEAAAAA,2450865,2450868,74566,1000.00,1,bar,N,N,N,N,N,N,N,N,Home great differences would not want orders; indiv,Unknown,N
1091,AAAAAAAADEEAAAAA,2450304,2450330,347834,1000.00,1,ought,Y,N,N,N,N,N,N,N,Roads could know more whole interests. Usual,Unknown,N
1092,AAAAAAAAEEEAAAAA,2450652,2450698,353308,1000.00,1,able,Y,N,N,N,N,N,N,N,Typical bottles participate then. ,Unknown,N
1093,AAAAAAAAFEEAAAAA,2450520,2450535,103090,1000.00,1,pri,Y,N,N,N,N,N,N,N,Pieces would open also video-taped villages,Unknown,N
1094,AAAAAAAAGEEAAAAA,2450388,2450430,5731,1000.00,1,ese,Y,N,N,N,N,N,N,N,Close\, main communic,Unknown,N
1095,AAAAAAAAHEEAAAAA,2450898,2450943,404236,1000.00,1,anti,N,N,N,N,N,N,N,N,Normal\, real results provide in short extra\, peculiar comp,Unknown,N
1096,AAAAAAAAIEEAAAAA,2450892,2450937,15008,1000.00,1,cally,Y,N,N,N,N,N,N,N,Laboratories differ generally down a sci,Unknown,N
1097,AAAAAAAAJEEAAAAA,2450771,2450805,368312,1000.00,1,ation,N,N,N,N,N,N,N,N,Massive\, new miles speak. Absolute\, spec,Unknown,N
1098,AAAAAAAAKEEAAAAA,2450417,2450431,311732,1000.00,1,eing,N,N,N,N,N,N,N,N,Doubts can raise now national things. Fit flo,Unknown,N
1099,AAAAAAAALEEAAAAA,2450775,2450791,271706,1000.00,1,n st,Y,N,N,N,N,N,N,N,Safe chiefs feel in the nations. Fresh\, new structures use,Unknown,N
1100,AAAAAAAAMEEAAAAA,\\N,\\N,41143,\\N,\\N,\\N,N,N,N,\\N,N,N,\\N,N,\\N,Unknown,\\N
1101,AAAAAAAANEEAAAAA,2450832,2450877,326074,1000.00,1,ought,Y,N,N,N,N,N,N,N,Other communications should spot sexual practices,Unknown,N
1102,AAAAAAAAOEEAAAAA,2450801,2450843,113488,1000.00,1,able,N,N,N,N,N,N,N,N,Useful times ought to spe,Unknown,N
1103,AAAAAAAAPEEAAAAA,2450383,2450405,456148,1000.00,1,pri,Y,N,N,N,N,N,N,N,Left\, professional decades should return years; he,Unknown,N
1104,AAAAAAAAAFEAAAAA,2450428,2450464,399220,1000.00,1,ese,Y,N,N,N,N,N,N,N,Overseas\, poor machin,Unknown,N
1105,AAAAAAAABFEAAAAA,2450555,\\N,\\N,\\N,\\N,anti,\\N,\\N,N,N,\\N,N,N,\\N,Completely good faces vote closer about a parties,\\N,\\N
1106,AAAAAAAACFEAAAAA,2450474,2450509,276080,1000.00,1,cally,N,N,N,N,N,N,N,N,Flat years can develop ,Unknown,N
1107,AAAAAAAADFEAAAAA,2450299,2450359,146206,1000.00,1,ation,N,N,N,N,N,N,N,N,Groups begin young cases. Then awful sources will w,Unknown,N
1108,AAAAAAAAEFEAAAAA,2450623,2450669,274675,1000.00,1,eing,Y,N,N,N,N,N,N,N,For example corporate patients could pick ot,Unknown,N
1109,AAAAAAAAFFEAAAAA,2450232,2450274,329623,1000.00,1,n st,N,N,N,N,N,N,N,N,Of course special men w,Unknown,N
1110,AAAAAAAAGFEAAAAA,2450102,2450118,199330,1000.00,1,bar,Y,N,N,N,N,N,N,N,Ago small gentlemen can trust t,Unknown,N
1111,AAAAAAAAHFEAAAAA,2450732,2450784,167887,1000.00,1,ought,Y,N,N,N,N,N,N,N,Local\, new views used to kn,Unknown,N
1112,AAAAAAAAIFEAAAAA,2450287,2450334,296854,1000.00,1,able,Y,N,N,N,N,N,N,N,Great\, male emotions shall not become incidentally,Unknown,N
1113,AAAAAAAAJFEAAAAA,2450831,2450865,360074,1000.00,1,pri,Y,N,N,N,N,N,N,N,Visitors meet around individual nations; answers must know ,Unknown,N
1114,AAAAAAAAKFEAAAAA,2450846,2450854,178870,1000.00,1,ese,N,N,N,N,N,N,N,N,Too broken rivers work. N,Unknown,N
1115,AAAAAAAALFEAAAAA,2450365,2450421,294550,1000.00,1,anti,Y,N,N,N,N,N,N,N,Officers will serve more except for the sh,Unknown,N
1116,AAAAAAAAMFEAAAAA,2450423,2450465,20432,1000.00,1,cally,Y,N,N,N,N,N,N,N,Hands will make so flat\, large-scale powers. Tota,Unknown,N
1117,AAAAAAAANFEAAAAA,2450293,2450338,36670,1000.00,1,ation,N,N,N,N,N,N,N,N,Great\, international grants observe here just maj,Unknown,N
1118,AAAAAAAAOFEAAAAA,2450502,2450506,165292,1000.00,1,eing,Y,N,N,N,N,N,N,N,Adequate eyes decide at least even light phrases. C,Unknown,N
1119,AAAAAAAAPFEAAAAA,2450858,2450917,383000,1000.00,1,n st,Y,N,N,N,N,N,N,N,Small rates resume on,Unknown,N
1120,AAAAAAAAAGEAAAAA,2450330,2450371,89059,1000.00,1,bar,Y,N,N,N,N,N,N,N,Years help now univer,Unknown,N
1121,AAAAAAAABGEAAAAA,2450467,2450500,269215,1000.00,1,ought,Y,N,N,N,N,N,N,N,Cold genes would not stay even highly ethnic dif,Unknown,N
1122,AAAAAAAACGEAAAAA,2450453,2450477,424928,1000.00,1,able,N,N,N,N,N,N,N,N,Details ought to increase presumably legal views;,Unknown,N
1123,AAAAAAAADGEAAAAA,2450356,2450394,196864,1000.00,1,pri,Y,N,N,N,N,N,N,N,Hard good items may ,Unknown,N
1124,AAAAAAAAEGEAAAAA,2450565,2450594,232360,1000.00,1,ese,N,N,N,N,N,N,N,N,Far answers show heavy,Unknown,N
1125,AAAAAAAAFGEAAAAA,2450848,2450900,152762,1000.00,1,anti,N,N,N,N,N,N,N,N,Equal\, essential terms result never; resources show th,Unknown,N
1126,AAAAAAAAGGEAAAAA,2450165,2450190,148651,1000.00,1,cally,Y,N,N,N,N,N,N,N,Easy facilities play reliably other\, dynamic wo,Unknown,N
1127,AAAAAAAAHGEAAAAA,2450136,2450164,136240,1000.00,1,ation,Y,N,N,N,N,N,N,N,Only following reservations open long on a patter,Unknown,N
1128,AAAAAAAAIGEAAAAA,2450623,2450642,108397,1000.00,1,eing,Y,N,N,N,N,N,N,N,Values will not keep with a patients. Here long coun,Unknown,N
1129,AAAAAAAAJGEAAAAA,2450774,2450786,398408,1000.00,1,n st,N,N,N,N,N,N,N,N,Black\, capable teams must not in,Unknown,N
1130,AAAAAAAAKGEAAAAA,2450131,2450174,384451,1000.00,1,bar,Y,N,N,N,N,N,N,N,Now global books write fast in a years. Average ,Unknown,N
1131,AAAAAAAALGEAAAAA,2450437,2450494,34508,1000.00,1,ought,Y,N,N,N,N,N,N,N,Proposals might produce then.,Unknown,N
1132,AAAAAAAAMGEAAAAA,2450701,2450727,347713,1000.00,1,able,N,N,N,N,N,N,N,N,Then due opinions should take emotionally calls. Books,Unknown,N
1133,AAAAAAAANGEAAAAA,2450163,2450223,428842,1000.00,1,pri,Y,N,N,N,N,N,N,N,Gently literary hours c,Unknown,N
1134,AAAAAAAAOGEAAAAA,2450286,2450331,335032,1000.00,1,ese,N,N,N,N,N,N,N,N,Good\, national amounts ensure after a others. British,Unknown,N
1135,AAAAAAAAPGEAAAAA,2450900,2450928,93835,1000.00,1,anti,N,N,N,N,N,N,N,N,For example right countries,Unknown,N
1136,AAAAAAAAAHEAAAAA,2450121,2450159,430408,1000.00,1,cally,Y,N,N,N,N,N,N,N,Past\, certain sites clean other values. Powerful men can t,Unknown,N
1137,AAAAAAAABHEAAAAA,2450181,2450233,151298,1000.00,1,ation,N,N,N,N,N,N,N,N,Organisms interpret correctly quarters; cells ,Unknown,N
1138,AAAAAAAACHEAAAAA,2450331,2450386,479584,1000.00,1,eing,N,N,N,N,N,N,N,N,Senior groups know other\, interesting publ,Unknown,N
1139,AAAAAAAADHEAAAAA,2450115,2450175,342316,1000.00,1,n st,N,N,N,N,N,N,N,N,Expected\, expensive friends shall enjoy even never majo,Unknown,N
1140,AAAAAAAAEHEAAAAA,2450523,2450556,159058,1000.00,1,bar,Y,N,N,N,N,N,N,N,Usually quiet things wil,Unknown,N
1141,AAAAAAAAFHEAAAAA,2450097,2450147,137443,1000.00,1,ought,Y,N,N,N,N,N,N,N,Products may teach f,Unknown,N
1142,AAAAAAAAGHEAAAAA,2450714,2450739,276620,1000.00,1,able,Y,N,N,N,N,N,N,N,Objects raise purposes; fun\, financial terms ought to see o,Unknown,N
1143,AAAAAAAAHHEAAAAA,2450707,2450714,340030,1000.00,1,pri,N,N,N,N,N,N,N,N,Marked\, successful names share indeed; large workers will,Unknown,N
1144,AAAAAAAAIHEAAAAA,2450305,2450341,449134,1000.00,1,ese,N,N,N,N,N,N,N,N,Direct years should result only for the institutions; fam,Unknown,N
1145,AAAAAAAAJHEAAAAA,2450846,2450885,175396,1000.00,1,anti,Y,N,N,N,N,N,N,N,Different\, famous habits c,Unknown,N
1146,AAAAAAAAKHEAAAAA,2450576,2450630,382304,1000.00,1,cally,N,N,N,N,N,N,N,N,New vessels offset in a sc,Unknown,N
1147,AAAAAAAALHEAAAAA,2450334,\\N,436123,1000.00,\\N,\\N,Y,N,N,\\N,\\N,N,N,\\N,\\N,Unknown,\\N
1148,AAAAAAAAMHEAAAAA,2450344,2450385,323804,1000.00,1,eing,N,N,N,N,N,N,N,N,Fortunes ought to re-open at the waves. Well-known,Unknown,N
1149,AAAAAAAANHEAAAAA,2450338,2450363,122836,1000.00,1,n st,Y,N,N,N,N,N,N,N,Common prices will seem th,Unknown,N
1150,AAAAAAAAOHEAAAAA,2450458,2450513,70636,1000.00,1,bar,N,N,N,N,N,N,N,N,Times suspend directly on the instances; narrow ,Unknown,N
1151,AAAAAAAAPHEAAAAA,2450161,2450202,315829,1000.00,1,ought,N,N,N,N,N,N,N,N,Gastric terms know. Persona,Unknown,N
1152,AAAAAAAAAIEAAAAA,2450326,2450386,480301,1000.00,1,able,Y,N,N,N,N,N,N,N,Organisations address p,Unknown,N
1153,AAAAAAAABIEAAAAA,2450315,2450372,198328,1000.00,1,pri,Y,N,N,N,N,N,N,N,Governments signal a,Unknown,N
1154,AAAAAAAACIEAAAAA,2450426,2450476,310870,1000.00,1,ese,N,N,N,N,N,N,N,N,Certainly illegal refugees know softly. As s,Unknown,N
1155,AAAAAAAADIEAAAAA,2450829,2450872,116944,1000.00,1,anti,Y,N,N,N,N,N,N,N,Republics make small schools. White\, local assets import p,Unknown,N
1156,AAAAAAAAEIEAAAAA,2450732,2450736,416008,1000.00,1,cally,N,N,N,N,N,N,N,N,Around little years grow of course environmen,Unknown,N
1157,AAAAAAAAFIEAAAAA,2450764,2450811,175166,1000.00,1,ation,Y,N,N,N,N,N,N,N,Peasants cannot vote so too ,Unknown,N
1158,AAAAAAAAGIEAAAAA,2450708,2450737,203788,1000.00,1,eing,Y,N,N,N,N,N,N,N,Old\, large papers would make well words. Rich\, ,Unknown,N
1159,AAAAAAAAHIEAAAAA,2450715,2450730,77968,1000.00,1,n st,N,N,N,N,N,N,N,N,Annual\, international meanings might not becom,Unknown,N
1160,AAAAAAAAIIEAAAAA,2450856,2450891,578,1000.00,1,bar,Y,N,N,N,N,N,N,N,Flats must not grow slightly amid a cases; so british ,Unknown,N
1161,AAAAAAAAJIEAAAAA,2450354,2450367,103370,1000.00,1,ought,Y,N,N,N,N,N,N,N,Hills introduce easily easily ideologica,Unknown,N
1162,AAAAAAAAKIEAAAAA,2450805,2450807,314444,1000.00,1,able,Y,N,N,N,N,N,N,N,Now model rooms used to find exactly ready other,Unknown,N
1163,AAAAAAAALIEAAAAA,2450433,2450446,264832,1000.00,1,pri,N,N,N,N,N,N,N,N,Fingers may happen; most assistant departments shall mark ev,Unknown,N
1164,AAAAAAAAMIEAAAAA,2450208,2450221,328015,1000.00,1,ese,N,N,N,N,N,N,N,N,Agencies fall very medical prospects. Historia,Unknown,N
1165,AAAAAAAANIEAAAAA,2450859,2450880,291590,1000.00,1,anti,N,N,N,N,N,N,N,N,Men benefit on a provisio,Unknown,N
1166,AAAAAAAAOIEAAAAA,2450232,2450286,185035,1000.00,1,cally,N,N,N,N,N,N,N,N,Difficult elections can serve with t,Unknown,N
1167,AAAAAAAAPIEAAAAA,2450355,2450356,14722,1000.00,1,ation,Y,N,N,N,N,N,N,N,As liberal contracts learn less to a,Unknown,N
1168,AAAAAAAAAJEAAAAA,2450511,2450563,214406,1000.00,1,eing,N,N,N,N,N,N,N,N,Sure\, free images might not pay good qu,Unknown,N
1169,AAAAAAAABJEAAAAA,2450796,2450839,459542,1000.00,1,n st,N,N,N,N,N,N,N,N,Important\, red crews could withdraw long\, european fact,Unknown,N
1170,AAAAAAAACJEAAAAA,2450792,2450845,96182,1000.00,1,bar,Y,N,N,N,N,N,N,N,Also superior forms play m,Unknown,N
1171,AAAAAAAADJEAAAAA,2450497,2450557,57760,1000.00,1,ought,N,N,N,N,N,N,N,N,Reasons shall threaten; powerful\, imp,Unknown,N
1172,AAAAAAAAEJEAAAAA,2450309,2450363,357152,1000.00,1,able,Y,N,N,N,N,N,N,N,Customers recall other others. Generally acute events m,Unknown,N
1173,AAAAAAAAFJEAAAAA,2450133,2450157,349058,1000.00,1,pri,Y,N,N,N,N,N,N,N,British\, electrical ,Unknown,N
1174,AAAAAAAAGJEAAAAA,2450367,2450407,352261,1000.00,1,ese,N,N,N,N,N,N,N,N,Political months know fully into a events. Good interests ,Unknown,N
1175,AAAAAAAAHJEAAAAA,2450656,2450658,389036,1000.00,1,anti,Y,N,N,N,N,N,N,N,German relatives used to locate real sales. Soci,Unknown,N
1176,AAAAAAAAIJEAAAAA,\\N,\\N,\\N,1000.00,\\N,\\N,Y,\\N,\\N,N,\\N,\\N,\\N,\\N,Regulations will want disabled\, basic respondents. ,Unknown,\\N
1177,AAAAAAAAJJEAAAAA,2450695,2450731,500792,1000.00,1,ation,Y,N,N,N,N,N,N,N,Main\, local workers feel a,Unknown,N
1178,AAAAAAAAKJEAAAAA,2450489,2450491,204152,1000.00,1,eing,N,N,N,N,N,N,N,N,New\, golden hearts may n,Unknown,N
1179,AAAAAAAALJEAAAAA,2450890,2450895,181468,1000.00,1,n st,N,N,N,N,N,N,N,N,Conflicts take more re,Unknown,N
1180,AAAAAAAAMJEAAAAA,2450877,2450881,411265,1000.00,1,bar,Y,N,N,N,N,N,N,N,Police should get specifically. Hard identical courts s,Unknown,N
1181,AAAAAAAANJEAAAAA,2450721,2450768,336970,1000.00,1,ought,N,N,N,N,N,N,N,N,Months can begin direct teachers. Used countries must not ,Unknown,N
1182,AAAAAAAAOJEAAAAA,2450140,2450159,477457,1000.00,1,able,N,N,N,N,N,N,N,N,Customers may not spend. Good compa,Unknown,N
1183,AAAAAAAAPJEAAAAA,2450410,2450465,370270,1000.00,1,pri,N,N,N,N,N,N,N,N,Formal\, necessary shareho,Unknown,N
1184,AAAAAAAAAKEAAAAA,2450214,2450240,328400,1000.00,1,ese,Y,N,N,N,N,N,N,N,Figures can provide no,Unknown,N
1185,AAAAAAAABKEAAAAA,2450096,2450153,139406,1000.00,1,anti,Y,N,N,N,N,N,N,N,Lengthy\, strong men would make alon,Unknown,N
1186,AAAAAAAACKEAAAAA,2450668,2450695,275704,1000.00,1,cally,Y,N,N,N,N,N,N,N,Large flowers think. Edges used to provide uniqu,Unknown,N
1187,AAAAAAAADKEAAAAA,2450512,2450571,23221,1000.00,1,ation,N,N,N,N,N,N,N,N,Materials see probably; thereby doubtful areas shall ,Unknown,N
1188,AAAAAAAAEKEAAAAA,2450547,2450553,124736,1000.00,1,eing,N,N,N,N,N,N,N,N,Political loans must play,Unknown,N
1189,AAAAAAAAFKEAAAAA,2450660,2450717,114868,1000.00,1,n st,N,N,N,N,N,N,N,N,Troops return about customers; positions lend now thu,Unknown,N
1190,AAAAAAAAGKEAAAAA,2450807,2450838,98692,1000.00,1,bar,N,N,N,N,N,N,N,N,Magistrates ought to leave less only resp,Unknown,N
1191,AAAAAAAAHKEAAAAA,2450798,2450846,30868,1000.00,1,ought,Y,N,N,N,N,N,N,N,Available studies put often eyes. Bishops m,Unknown,N
1192,AAAAAAAAIKEAAAAA,2450234,2450253,166256,1000.00,1,able,Y,N,N,N,N,N,N,N,Demanding\, growing cases used to get completely existin,Unknown,N
1193,AAAAAAAAJKEAAAAA,2450148,2450199,383491,1000.00,1,pri,N,N,N,N,N,N,N,N,Internal\, foreign incidents used to com,Unknown,N
1194,AAAAAAAAKKEAAAAA,2450829,2450885,184676,1000.00,1,ese,N,N,N,N,N,N,N,N,National men can succeed si,Unknown,N
1195,AAAAAAAALKEAAAAA,2450863,2450891,130564,1000.00,1,anti,Y,N,N,N,N,N,N,N,Years give from the funds. Only tech,Unknown,N
1196,AAAAAAAAMKEAAAAA,2450765,2450815,189908,1000.00,1,cally,N,N,N,N,N,N,N,N,New problems cause to a weeks. Divine books bid again; ho,Unknown,N
1197,AAAAAAAANKEAAAAA,2450480,2450528,39766,1000.00,1,ation,N,N,N,N,N,N,N,N,Other\, large spaces could begin br,Unknown,N
1198,AAAAAAAAOKEAAAAA,2450809,2450849,301754,1000.00,1,eing,Y,N,N,N,N,N,N,N,Innocently persistent posit,Unknown,N
1199,AAAAAAAAPKEAAAAA,2450764,2450785,348631,1000.00,1,n st,N,N,N,N,N,N,N,N,Narrow\, monthly activities head forwa,Unknown,N
1200,AAAAAAAAALEAAAAA,2450322,2450324,321866,1000.00,1,bar,Y,N,N,N,N,N,N,N,Poems would climb too from a reasons. Relatively new compa,Unknown,N
1201,AAAAAAAABLEAAAAA,2450383,2450401,2708,1000.00,1,ought,Y,N,N,N,N,N,N,N,So possible men ought to look in a foreigners. Pr,Unknown,N
1202,AAAAAAAACLEAAAAA,2450763,2450786,236648,1000.00,1,able,N,N,N,N,N,N,N,N,Years used to represent ,Unknown,N
1203,AAAAAAAADLEAAAAA,2450656,2450716,473306,1000.00,1,pri,Y,N,N,N,N,N,N,N,Plans cannot go for a problems. Following\,,Unknown,N
1204,AAAAAAAAELEAAAAA,2450676,2450734,165067,1000.00,1,ese,Y,N,N,N,N,N,N,N,Names will want separate rates; blue\,,Unknown,N
1205,AAAAAAAAFLEAAAAA,2450730,2450790,239551,1000.00,1,anti,N,N,N,N,N,N,N,N,Bare lands become. Judicial gains promise yet low high ye,Unknown,N
